key,en,ko,ar,ja,source
"BLOG[0].author","SafeDoc Editorial","세이프닥 편집팀","فريق تحرير SafeDoc","SafeDoc 編集部","data.js"
"BLOG[0].title","A Foreigner's Guide to Health Checkups in Korea","외국인을 위한 한국 건강검진 가이드","دليل الأجانب للفحوصات الصحية في كوريا","外国人のための韓国健康診断ガイド","data.js"
"BLOG[0].excerpt","What to expect, what's included, and how to choose the right package.","무엇을 기대할 수 있는지, 무엇이 포함되는지, 알맞은 패키지를 고르는 법.","ما الذي يمكن توقعه، وما الذي يشمله الفحص، وكيف تختار الباقة المناسبة.","何が期待でき、何が含まれ、自分に合ったパッケージをどう選ぶか。","data.js"
"BLOG[0].sections[0].h","Why Korea for a health checkup","왜 한국에서 건강검진을 받을까","لماذا كوريا لإجراء الفحص الصحي","なぜ韓国で健康診断を受けるのか","data.js"
"BLOG[0].sections[0].p[0]","Korea's checkup centers combine speed, advanced imaging and value in a single half-day visit. A comprehensive package that takes weeks to arrange elsewhere is often completed before lunch here.","한국의 검진센터는 속도·첨단 영상장비·가치를 반나절 방문에 모두 담아냅니다. 다른 나라에서는 수 주가 걸리는 종합검진이 이곳에서는 점심 전에 끝나기도 합니다.","تجمع مراكز الفحص في كوريا بين السرعة والتصوير المتقدم والقيمة في زيارة واحدة تستغرق نصف يوم. فالباقة الشاملة التي تحتاج أسابيع لترتيبها في أماكن أخرى تكتمل هنا قبل الغداء غالباً.","韓国の検診センターは、スピード・先進的な画像診断・コストパフォーマンスを半日の受診にまとめています。他国では数週間かかる総合検診が、ここでは昼食前に終わることもあります。","data.js"
"BLOG[0].sections[0].p[1]","For international patients, the appeal is not only the technology but the coordination: interpreters, transport and reservations handled end to end.","해외 환자에게 매력은 기술만이 아닙니다. 통역·이동·예약까지 처음부터 끝까지 조율되는 편리함이 핵심입니다.","بالنسبة للمرضى الدوليين، لا تكمن الجاذبية في التقنية فحسب، بل في التنسيق: مترجمون ونقل وحجوزات تُدار من البداية إلى النهاية.","海外からの患者にとっての魅力は技術だけではありません。通訳・移動・予約まで一貫して手配される利便性が鍵です。","data.js"
"BLOG[0].sections[1].h","Choosing the right package","알맞은 패키지 고르기","اختيار الباقة المناسبة","自分に合ったパッケージの選び方","data.js"
"BLOG[0].sections[1].p[0]","Basic packages cover blood work, an abdominal ultrasound and a chest X-ray. Premium tiers add endoscopy, low-dose CT and brain MRI. Start from your age, family history and the organs you want screened.","기본 패키지는 혈액검사·복부초음파·흉부 X-ray를 포함합니다. 프리미엄은 내시경·저선량 CT·뇌 MRI가 더해집니다. 나이·가족력·검진하고 싶은 장기를 기준으로 선택하세요.","تشمل الباقات الأساسية تحاليل الدم وتصوير البطن بالموجات فوق الصوتية وأشعة الصدر السينية. وتضيف الباقات المميّزة التنظير والأشعة المقطعية منخفضة الجرعة والرنين المغناطيسي للدماغ. ابدأ من عمرك وتاريخك العائلي والأعضاء التي تريد فحصها.","基本パッケージには血液検査・腹部超音波・胸部レントゲンが含まれます。プレミアムでは内視鏡・低線量CT・脳MRIが加わります。年齢・家族歴・検査したい臓器を基準に選びましょう。","data.js"
"BLOG[0].sections[2].h","The day of your checkup","검진 당일 흐름","يوم الفحص","検診当日の流れ","data.js"
"BLOG[0].sections[2].p[0]","Fast for 8 hours beforehand. On arrival you'll change, complete a questionnaire, then move through stations in sequence. Results for most items are ready the same day, with a doctor's consultation to close.","8시간 금식 후 방문합니다. 도착하면 검진복으로 갈아입고 문진표를 작성한 뒤 순서대로 검사 스테이션을 이동합니다. 대부분 항목은 당일 결과가 나오며, 의사 상담으로 마무리합니다.","صُم لمدة 8 ساعات قبل الموعد. عند الوصول ستبدّل ملابسك وتملأ استبياناً ثم تنتقل بين محطات الفحص بالترتيب. تكون نتائج معظم البنود جاهزة في اليوم نفسه، وتُختتم باستشارة الطبيب.","事前に8時間絶食します。到着後は検診着に着替え、問診票を記入し、各検査を順に受けます。多くの項目は当日中に結果が出て、医師の相談で締めくくります。","data.js"
"BLOG[0].sections[3].h","Reading your report","리포트 해석하기","قراءة تقريرك","検査レポートの読み方","data.js"
"BLOG[0].sections[3].p[0]","SafeDoc issues a translated report and, when needed, connects you with a specialist for follow-up back home. Keep the file — it's the baseline for your next visit.","세이프닥은 번역된 리포트를 발급하고, 필요 시 귀국 후 추적을 위해 전문의를 연결합니다. 파일은 보관하세요. 다음 검진의 기준선이 됩니다.","يصدر SafeDoc تقريراً مترجماً، وعند الحاجة يصلك بأخصائي للمتابعة بعد عودتك إلى بلدك. احتفظ بالملف — فهو خط الأساس لزيارتك القادمة.","SafeDoc は翻訳済みのレポートを発行し、必要に応じて帰国後のフォローアップのために専門医をご紹介します。ファイルは保管してください — 次回検診の基準になります。","data.js"
"BLOG[1].author","Dr. J. Kim","김 원장","د. ج. كيم","キム・J 医師","data.js"
"BLOG[1].title","Why SMILE LASIK Is So Popular in Korea","한국에서 스마일 라식이 인기 있는 이유","لماذا يحظى SMILE LASIK بشعبية كبيرة في كوريا","韓国でSMILE LASIKが人気の理由","data.js"
"BLOG[1].excerpt","Minimally-invasive, fast recovery, and trusted surgeons.","최소 침습, 빠른 회복, 신뢰받는 의료진.","تدخل جراحي طفيف، وتعافٍ سريع، وجراحون موثوقون.","低侵襲、早い回復、信頼できる医師。","data.js"
"BLOG[1].sections[0].h","What makes SMILE different","스마일이 다른 점","ما الذي يميّز SMILE","SMILE の違いとは","data.js"
"BLOG[1].sections[0].p[0]","SMILE uses a tiny 2–4mm incision instead of the larger flap of traditional LASIK. Less surface disruption means faster healing and noticeably less dry eye.","스마일은 전통 라식의 큰 절편 대신 2~4mm의 작은 절개를 사용합니다. 표면 손상이 적어 회복이 빠르고 안구건조가 눈에 띄게 적습니다.","يستخدم SMILE شقاً صغيراً بحجم 2–4 مم بدلاً من السديلة الأكبر في الليزك التقليدي. وقلة اضطراب السطح تعني تعافياً أسرع وجفاف عين أقل بشكل ملحوظ.","SMILE は従来のLASIKの大きなフラップではなく、2〜4mmの小さな切開で行います。表面へのダメージが少ないため、回復が早く、ドライアイも明らかに軽減されます。","data.js"
"BLOG[1].sections[1].h","High volume, refined technique","높은 시술량, 정교해진 기술","حجم مرتفع وتقنية متقنة","豊富な症例数と洗練された技術","data.js"
"BLOG[1].sections[1].p[0]","Seoul's leading clinics perform SMILE at scale, and that repetition sharpens outcomes. Ask for the surgeon's case count and complication rate — reputable centers share it openly.","서울의 선도 클리닉은 스마일을 대량으로 시행하며, 그 반복이 결과를 정교하게 만듭니다. 집도의의 케이스 수와 합병증률을 물어보세요. 신뢰할 만한 센터는 이를 투명하게 공개합니다.","تُجري عيادات سيول الرائدة عمليات SMILE على نطاق واسع، وهذا التكرار يصقل النتائج. اسأل عن عدد حالات الجرّاح ومعدّل المضاعفات — فالمراكز الموثوقة تشاركها بصراحة.","ソウルの主要クリニックは SMILE を大量に手がけており、その積み重ねが結果を精緻にします。執刀医の症例数と合併症率を尋ねましょう — 信頼できる施設は率直に開示します。","data.js"
"BLOG[1].sections[2].h","Are you a candidate?","나는 대상이 될까?","هل أنت مرشّح مناسب؟","あなたは適応対象ですか？","data.js"
"BLOG[1].sections[2].p[0]","Stable prescription, healthy corneal thickness and no active eye disease are the baseline. A pre-op exam confirms fit; SafeDoc can arrange it on the same trip as your consultation.","안정된 도수, 충분한 각막 두께, 활동성 안질환이 없는 것이 기본 조건입니다. 수술 전 검사로 적합성을 확인하며, 세이프닥이 상담과 같은 일정으로 잡아드립니다.","الوصفة المستقرة وسماكة القرنية الصحية وعدم وجود مرض عيني نشط هي الحد الأساسي. ويؤكّد فحص ما قبل العملية مدى الملاءمة؛ ويمكن لـ SafeDoc ترتيبه في نفس رحلة استشارتك.","安定した度数、十分な角膜厚、活動性の眼疾患がないことが基本条件です。術前検査で適応を確認します。SafeDoc が相談と同じ日程で手配できます。","data.js"
"BLOG[2].author","SafeDoc Editorial","세이프닥 편집팀","فريق تحرير SafeDoc","SafeDoc 編集部","data.js"
"BLOG[2].title","Medical Tax Refund for Foreign Patients","외국인 환자를 위한 의료 세금 환급","استرداد الضرائب الطبية للمرضى الأجانب","外国人患者のための医療費税金還付","data.js"
"BLOG[2].excerpt","How to claim your refund at the airport — step by step.","공항에서 환급받는 법 — 단계별 안내.","كيفية استرداد مبلغك في المطار — خطوة بخطوة.","空港で還付を受ける方法 — ステップごとに解説。","data.js"
"BLOG[2].sections[0].h","What qualifies","환급 대상","ما الذي يكون مؤهلاً","還付の対象","data.js"
"BLOG[2].sections[0].p[0]","Cosmetic and selected elective procedures at registered clinics qualify for a foreigner medical tax refund. Your clinic marks eligibility on the receipt at checkout.","등록된 의료기관의 미용·일부 선택 시술은 외국인 의료 세금 환급 대상입니다. 결제 시 병원이 영수증에 대상 여부를 표시합니다.","تكون إجراءات التجميل وبعض الإجراءات الاختيارية في العيادات المسجّلة مؤهلة لاسترداد الضريبة الطبية للأجانب. وتحدّد عيادتك الأهلية على الإيصال عند الدفع.","登録医療機関での美容および一部の選択的施術は、外国人向け医療税還付の対象です。会計時にクリニックが領収書に対象可否を記載します。","data.js"
"BLOG[2].sections[1].h","Keep these documents","챙겨야 할 서류","احتفظ بهذه المستندات","保管すべき書類","data.js"
"BLOG[2].sections[1].p[0]","Hold on to the tax-refund receipt and the documents SafeDoc issues. You'll need your passport and the original receipts at the kiosk.","세금환급 영수증과 세이프닥이 발급한 서류를 보관하세요. 키오스크에서 여권과 원본 영수증이 필요합니다.","احتفظ بإيصال استرداد الضريبة وبالمستندات التي يصدرها SafeDoc. ستحتاج إلى جواز سفرك والإيصالات الأصلية عند الكشك.","税還付の領収書と SafeDoc が発行する書類を保管してください。キオスクではパスポートと原本の領収書が必要です。","data.js"
"BLOG[2].sections[2].h","Claiming at the airport","공항에서 환급받기","الاسترداد في المطار","空港での還付手続き","data.js"
"BLOG[2].sections[2].p[0]","Before departure, scan your documents at the airport refund kiosk and receive cash or a card refund. Allow extra time during peak travel hours.","출국 전 공항 환급 키오스크에서 서류를 스캔하고 현금 또는 카드로 환급받으세요. 성수기에는 여유 시간을 두세요.","قبل المغادرة، امسح مستنداتك ضوئياً في كشك الاسترداد بالمطار واحصل على المبلغ نقداً أو على البطاقة. واحتسب وقتاً إضافياً في ساعات الذروة.","出国前に空港の還付キオスクで書類をスキャンし、現金またはカードで還付を受けます。繁忙時間帯は余裕をもってお越しください。","data.js"
"BLOG[3].author","SafeDoc Editorial","세이프닥 편집팀","فريق تحرير SafeDoc","SafeDoc 編集部","data.js"
"BLOG[3].title","Where to Recover in Seoul After a Procedure","시술 후 서울에서 회복하기 좋은 곳","أين تتعافى في سيول بعد الإجراء","施術後、ソウルで回復するのに適した場所","data.js"
"BLOG[3].excerpt","Quiet neighborhoods, aftercare-friendly stays and how to plan a comfortable recovery window.","조용한 동네, 회복에 좋은 숙소, 그리고 편안한 회복 기간을 계획하는 법.","أحياء هادئة، وأماكن إقامة مناسبة للرعاية اللاحقة، وكيفية التخطيط لفترة تعافٍ مريحة.","静かな街、アフターケアに適した宿泊先、そして快適な回復期間の計画の立て方。","data.js"
"BLOG[3].sections[0].h","Plan your recovery window","회복 기간 계획하기","خطّط لفترة تعافيك","回復期間を計画する","data.js"
"BLOG[3].sections[0].p[0]","Match your stay to the procedure. A day checkup needs no downtime; surgery may call for several quiet days near your clinic before you're cleared to fly.","시술에 맞춰 체류 기간을 정하세요. 당일 검진은 휴식이 필요 없지만, 수술은 귀국 허가 전 병원 근처에서 며칠의 안정이 필요할 수 있습니다.","طابِق مدة إقامتك مع الإجراء. فالفحص اليومي لا يتطلّب فترة نقاهة؛ أما الجراحة فقد تستدعي عدة أيام هادئة قرب عيادتك قبل السماح لك بالسفر جواً.","施術内容に合わせて滞在期間を決めましょう。日帰り検診に休養は不要ですが、手術の場合は搭乗許可が出るまでクリニック近くで数日の安静が必要なこともあります。","data.js"
"BLOG[3].sections[1].h","Aftercare-friendly stays","회복에 좋은 숙소","أماكن إقامة مناسبة للرعاية اللاحقة","アフターケアに適した宿泊先","data.js"
"BLOG[3].sections[1].p[0]","Look for step-free access, room service and proximity to your clinic. SafeDoc can book partner stays with late checkout and airport transfers built in.","계단 없는 동선, 룸서비스, 병원과의 근접성을 확인하세요. 세이프닥은 늦은 체크아웃과 공항 이동이 포함된 제휴 숙소를 예약해 드립니다.","ابحث عن مدخل خالٍ من الدرجات وخدمة الغرف والقرب من عيادتك. ويمكن لـ SafeDoc حجز أماكن إقامة شريكة تشمل تسجيل خروج متأخّراً ونقلاً من المطار وإليه.","段差のない動線、ルームサービス、クリニックへの近さを確認しましょう。SafeDoc はレイトチェックアウトや空港送迎付きの提携宿泊先を予約できます。","data.js"
"BLOG[3].sections[2].h","Calm neighborhoods","차분한 동네","أحياء هادئة","落ち着いた街","data.js"
"BLOG[3].sections[2].p[0]","Seocho, Yeonnam and parts of Gangnam offer quiet streets, pharmacies and cafés within walking distance — ideal while you take it easy.","서초·연남·강남 일부는 조용한 거리와 약국·카페가 도보권에 있어 편히 쉬기에 좋습니다.","توفّر سيوتشو ويونّام وأجزاء من غانغنام شوارع هادئة وصيدليات ومقاهي على مسافة قريبة سيراً — مثالية بينما تأخذ راحتك.","瑞草（ソチョ）、延南（ヨンナム）、江南（カンナム）の一部は、静かな通りや薬局・カフェが徒歩圏にあり、ゆっくり過ごすのに最適です。","data.js"
"BLOG[4].author","Dr. S. Park","박 원장","د. س. بارك","パク・S 医師","data.js"
"BLOG[4].title","Dental Implants in Korea: Quality Meets Value","한국의 임플란트: 품질과 가치의 균형","زراعة الأسنان في كوريا: الجودة تلتقي بالقيمة","韓国のインプラント：品質と価値の両立","data.js"
"BLOG[4].excerpt","Why patients travel for implants — digital planning, same-week workflows and transparent pricing.","환자들이 임플란트를 위해 한국을 찾는 이유 — 디지털 설계, 당주 진행, 투명한 가격.","لماذا يسافر المرضى لزراعة الأسنان — تخطيط رقمي، وإجراءات في نفس الأسبوع، وأسعار شفافة.","患者がインプラントのために韓国を訪れる理由 — デジタル設計、同一週での進行、透明な価格。","data.js"
"BLOG[4].sections[0].h","Digital, precise planning","디지털 정밀 설계","تخطيط رقمي دقيق","デジタルで精密な設計","data.js"
"BLOG[4].sections[0].p[0]","3D scans and guided surgery let Korean clinics place implants with tight precision, shortening chair time and improving fit.","3D 스캔과 가이드 수술로 한국 클리닉은 임플란트를 정밀하게 식립합니다. 진료 시간을 줄이고 적합도를 높입니다.","تتيح عمليات المسح ثلاثي الأبعاد والجراحة الموجَّهة للعيادات الكورية زرع الغرسات بدقة عالية، ما يقلّل وقت الجلوس على الكرسي ويحسّن الملاءمة.","3Dスキャンとガイドサージェリーにより、韓国のクリニックはインプラントを高精度で埋入し、チェアタイムを短縮して適合性を高めます。","data.js"
"BLOG[4].sections[1].h","A realistic timeline","현실적인 일정","جدول زمني واقعي","現実的なスケジュール","data.js"
"BLOG[4].sections[1].p[0]","Osseointegration still takes months, but the surgical and prosthetic visits can be compressed. Plan two trips, or a single longer stay with SafeDoc coordinating both stages.","골유착에는 여전히 수개월이 걸리지만, 수술과 보철 방문은 압축할 수 있습니다. 두 번의 방문 또는 세이프닥이 두 단계를 조율하는 한 번의 긴 체류를 계획하세요.","لا يزال الاندماج العظمي يستغرق أشهراً، لكن يمكن ضغط زيارات الجراحة والتركيبات. خطّط لرحلتين، أو لإقامة واحدة أطول ينسّق فيها SafeDoc كلتا المرحلتين.","骨結合には依然として数か月かかりますが、手術と補綴の通院は圧縮できます。2回の渡航、または SafeDoc が両段階を調整する1回の長期滞在を計画しましょう。","data.js"
"BLOG[5].author","SafeDoc Editorial","세이프닥 편집팀","فريق تحرير SafeDoc","SafeDoc 編集部","data.js"
"BLOG[5].title","Understanding Korea's Medical Visa","한국 의료 비자 완전 정복","دليلك إلى التأشيرة الطبية الكورية","韓国の医療ビザ完全ガイド","data.js"
"BLOG[5].excerpt","Who needs one, what documents to prepare, and how SafeDoc supports your application.","누가 필요하고, 어떤 서류를 준비하며, 세이프닥이 신청을 어떻게 돕는지.","من يحتاجها، وما المستندات التي يجب تجهيزها، وكيف يدعم SafeDoc طلبك.","誰に必要か、どんな書類を準備するか、そして SafeDoc がどう申請を支援するか。","data.js"
"BLOG[5].sections[0].h","Who needs a medical visa","누가 의료 비자가 필요한가","من يحتاج إلى تأشيرة طبية","医療ビザが必要な人","data.js"
"BLOG[5].sections[0].p[0]","Short checkups often fit within a tourist entry, but longer treatment or repeated visits may call for a C-3-3 or G-1-10 medical visa. Your treatment plan determines the route.","짧은 검진은 관광 입국으로 가능하지만, 장기 치료나 반복 방문은 C-3-3 또는 G-1-10 의료 비자가 필요할 수 있습니다. 치료 계획이 경로를 결정합니다.","غالباً ما تتّسع تأشيرة السياحة للفحوصات القصيرة، لكن العلاج الأطول أو الزيارات المتكرّرة قد يتطلّب تأشيرة طبية من نوع C-3-3 أو G-1-10. وخطة علاجك هي التي تحدّد المسار.","短期の検診は観光入国で対応できることが多いですが、長期治療や繰り返しの来訪には C-3-3 または G-1-10 医療ビザが必要になる場合があります。治療計画によって経路が決まります。","data.js"
"BLOG[5].sections[1].h","Documents to prepare","준비할 서류","المستندات المطلوب تجهيزها","準備する書類","data.js"
"BLOG[5].sections[1].p[0]","You'll typically need a treatment confirmation from the hospital, proof of funds and travel details. SafeDoc issues the medical documentation invitation letters rely on.","보통 병원의 진료 확인서, 재정 증빙, 여행 정보가 필요합니다. 세이프닥은 초청장이 근거로 삼는 의료 서류를 발급합니다.","ستحتاج عادةً إلى تأكيد علاج من المستشفى وإثبات مالي وتفاصيل السفر. ويصدر SafeDoc المستندات الطبية التي تعتمد عليها خطابات الدعوة.","通常、病院の治療確認書、資金証明、渡航情報が必要です。SafeDoc は招へい状の根拠となる医療書類を発行します。","data.js"
"BLOG[5].sections[2].h","How SafeDoc helps","세이프닥의 지원","كيف يساعد SafeDoc","SafeDoc の支援","data.js"
"BLOG[5].sections[2].p[0]","From the invitation letter to appointment scheduling that matches your visa window, we align the paperwork with your itinerary so nothing stalls at the consulate.","초청장부터 비자 기간에 맞춘 예약까지, 서류와 일정을 정렬해 영사관에서 지체되는 일이 없도록 합니다.","من خطاب الدعوة إلى جدولة المواعيد بما يتوافق مع فترة تأشيرتك، ننسّق الأوراق مع برنامج رحلتك حتى لا يتعطّل شيء لدى القنصلية.","招へい状からビザ期間に合わせた予約調整まで、書類と日程を整合させ、領事館で滞ることがないようにします。","data.js"
"BLOG[6].author","Dr. H. Lee","이 원장","د. هـ. لي","イ・H 医師","data.js"
"BLOG[6].title","K-Beauty Dermatology: What to Know Before You Go","K-뷰티 피부과: 가기 전에 알아둘 것","جلدية الجمال الكوري: ما يجب معرفته قبل الذهاب","K-ビューティー皮膚科：行く前に知っておくこと","data.js"
"BLOG[6].excerpt","Lasers, injectables and skin-boosters — how to plan safe, effective treatments on a short trip.","레이저·주사·스킨부스터 — 짧은 일정에서 안전하고 효과적인 시술을 계획하는 법.","الليزر والحقن ومعزّزات البشرة — كيف تخطّط لعلاجات آمنة وفعّالة في رحلة قصيرة.","レーザー・注射・スキンブースター — 短い旅程で安全かつ効果的な施術を計画する方法。","data.js"
"BLOG[6].sections[0].h","Popular treatments","인기 시술","العلاجات الشائعة","人気の施術","data.js"
"BLOG[6].sections[0].p[0]","Laser toning, fractional resurfacing, injectables and skin-boosters lead the menu. Match the treatment to your recovery time — some leave redness for a few days.","레이저 토닝·프락셔널·주사·스킨부스터가 대표적입니다. 회복 시간에 맞춰 시술을 선택하세요. 일부는 며칠간 홍조가 남습니다.","يتصدّر القائمة تفتيح الليزر والتقشير الجزئي والحقن ومعزّزات البشرة. طابِق العلاج مع وقت تعافيك — فبعضها يترك احمراراً لبضعة أيام.","レーザートーニング・フラクショナル・注射・スキンブースターが代表的です。回復時間に合わせて施術を選びましょう。一部は数日間赤みが残ります。","data.js"
"BLOG[6].sections[1].h","Planning a short trip","짧은 일정 계획하기","التخطيط لرحلة قصيرة","短い旅程を計画する","data.js"
